<?xml version="1.0" encoding="utf-8"?>
<hat xmlns:xsi="http://www.w3.org/2001/XMLSchema-instance"
     xsi:noNamespaceSchemaLocation="../../../schemas/quackhat.xsd"
     name="qUAckzak Cossack">
  <component id="moustache"
             sprite="components/moustache.png"
             frameWidth="48"
             frameHeight="24"
             offsetX="3"
             offsetY="-2"
             layer="foreground">
    <animation trigger="default"
               firstFrame="0"
               lastFrame="3"
               ticksPerFrame="5" />
  </component>
  <component id="hair"
             sprite="components/hair.png"
             frameWidth="32"
             frameHeight="48"
             offsetX="4"
             offsetY="-10"
             layer="behind">
    <animation trigger="default"
               firstFrame="0"
               lastFrame="3"
               ticksPerFrame="5" />
    <animation trigger="airborne"
               firstFrame="4"
               lastFrame="7"
               ticksPerFrame="3" />
  </component>

  <component id="windmill"
             sprite="components/pets/windmill.png"
             offsetX="-28"
             offsetY="-12"
             facing="movement"
             controller="flying_follower"
             speed="2"
             group="pets" />
  <component id="windmill-wings"
             sprite="components/pets/windmill-wings.png"
             frameWidth="48"
             frameHeight="48"
             parent="windmill"
             layer="inherit">
    <animation trigger="default"
               firstFrame="0"
               lastFrame="3"
               ticksPerFrame="3" />
  </component>

  <component id="sharovary"
             sprite="components/pets/sharovary.png"
             frameWidth="48"
             frameHeight="48"
             offsetX="-28"
             offsetY="8"
             facing="movement"
             controller="ground_follower"
             speed="2"
             group="pets">
    <animation trigger="follower_moving"
               firstFrame="0"
               lastFrame="1"
               ticksPerFrame="4" />
    <animation trigger="follower_idle"
               firstFrame="2"
               lastFrame="3"
               ticksPerFrame="5" />
  </component>

  <component id="cannon"
             sprite="components/pets/cannon.png"
             offsetX="-30"
             offsetY="8"
             facing="movement"
             controller="ground_follower"
             speed="1.5"
             group="pets" />

  <component id="chaika"
             sprite="components/pets/chaika.png"
             offsetX="-32"
             offsetY="6"
             facing="movement"
             controller="flying_follower"
             speed="1.5"
             group="pets" />

  <component id="barrel"
             sprite="components/pets/barrel.png"
             frameWidth="48"
             frameHeight="48"
             offsetX="-28"
             offsetY="8"
             facing="fixed"
             controller="ground_follower"
             speed="2"
             group="pets">
    <animation trigger="follower_moving"
               firstFrame="0"
               lastFrame="3"
               ticksPerFrame="3" />
    <animation trigger="follower_idle"
               firstFrame="0"
               lastFrame="0"
               ticksPerFrame="1" />
  </component>

  <component id="pipe"
             sprite="components/decorations/pipe.png"
             offsetX="6"
             offsetY="-2" />

  <component id="vyshyvanka"
             sprite="components/decorations/vyshyvanka.png"
             frameWidth="48"
             frameHeight="48"
             offsetY="5">
    <animation trigger="default"
               firstFrame="0"
               lastFrame="0"
               ticksPerFrame="1" />
    <animation trigger="running"
               firstFrame="1"
               lastFrame="3"
               ticksPerFrame="3" />
  </component>

  <component id="bandura"
             sprite="components/decorations/bandura.png"
             offsetX="-5"
             offsetY="3"
             layer="behind" />

  <component id="banner"
             sprite="components/decorations/banner.png"
             frameWidth="48"
             frameHeight="64"
             offsetX="-12"
             offsetY="-12"
             layer="behind">
    <animation trigger="default"
               firstFrame="0"
               lastFrame="3"
               ticksPerFrame="4" />
  </component>

  <component id="saber"
             sprite="components/decorations/saber.png"
             offsetX="8"
             offsetY="4" />

  <component id="sunflower"
             sprite="components/effects/sunflower.png"
             frameWidth="24"
             frameHeight="24"
             offsetY="10"
             layer="behind"
             facing="fixed">
    <animation trigger="default"
               firstFrame="0"
               lastFrame="3"
               ticksPerFrame="4" />
    <emitter condition="running"
             cadence="distance"
             minimumInterval="8"
             maximumInterval="16" />
  </component>

  <component id="pipe-smoke"
             sprite="components/effects/pipe-smoke.png"
             frameWidth="16"
             frameHeight="16"
             parent="pipe"
             offsetY="-3">
    <animation trigger="default"
               firstFrame="0"
               lastFrame="3"
               ticksPerFrame="4" />
    <emitter condition="default"
             cadence="time"
             minimumInterval="30"
             maximumInterval="60" />
  </component>

  <component id="spirit"
             sprite="components/effects/spirit.png"
             frameWidth="32"
             frameHeight="48"
             offsetY="-8"
             layer="foreground"
             controller="world_one_shot">
    <animation trigger="death"
               firstFrame="0"
               lastFrame="3"
               ticksPerFrame="5" />
  </component>

  <component id="saber-glint"
             sprite="components/effects/saber-glint.png"
             frameWidth="16"
             frameHeight="16"
             parent="saber"
             offsetX="4"
             offsetY="-5"
             layer="foreground">
    <animation trigger="direction_changed"
               firstFrame="0"
               lastFrame="3"
               ticksPerFrame="3" />
  </component>

  <component id="death-animation"
             sprite="components/effects/death-animation.png"
             frameWidth="48"
             frameHeight="48"
             layer="foreground"
             controller="world_one_shot">
    <animation trigger="death"
               firstFrame="0"
               lastFrame="3"
               ticksPerFrame="4" />
    <animation trigger="death"
               firstFrame="4"
               lastFrame="7"
               ticksPerFrame="4" />
    <animation trigger="death"
               firstFrame="8"
               lastFrame="11"
               ticksPerFrame="4" />
  </component>
</hat>
